index,event,disaster,class_label,clean_text,has_crisis_term
1170,other_disaster,True,requests_or_needs,food and of tent we live in a very critical situation if heit pleases you us count on your understanding thank you that god you bless,False
1171,other_disaster,True,requests_or_needs,a cold front is over cuba this morning. it could cross haiti tomorrow. isolated storms are already forecast for our region tonight.,False
1172,earthquake,True,affected_individual,breaking news death toll in philippines quake approaches 100,False
1173,other_disaster,True,requests_or_needs,i can donate water towels clothing . please let me know where to bring it .,False
1174,typhoon,True,donation_and_volunteering,watch mv22 ospreys transport marines to provide disaster relief in the wake of typhoon haiyan.,False
1175,flood,True,donation_and_volunteering,can somebody call rescueph team to priorities ust hospital generators are down and needs urgent help.,True
1176,hurricane,True,donation_and_volunteering,sikhs serve people impacted by hurricane harvey harveyrelief seva view video,True
1177,bombing,True,affected_individual,uncle of marathon bombing suspects speaks boston,False
1178,earthquake,True,injured_or_dead_people,chile 8.2 quake leaves 6 dead causes less damage than feared 39 of 300 prisoners who escaped still at large,True
1179,flood,True,donation_and_volunteering,can you help with longterm housing of boulderflood victims please let us know boulderfloodrelief at gmail dot com,True
1180,wildfire,True,donation_and_volunteering,california doctor hops on motorcycle to help evacuate babies during wildfires via fox news,True
1181,flood,True,infrastructure_and_utilities_damage,when exactly was the bonnybrook bridge inspected last what exactly is in the rail cars thank u in advance. yycflood,True
1182,other_disaster,True,requests_or_needs,the fresh flooding in jaffarabad aggravated the misery of thousands of displaced people from sindh and balochistan who could not reach safe places and had taken refuge near pat feeder canal and other high places.,True
1183,typhoon,True,affected_individual,lucky to leave a few days earlier bbc news philippines typhoon bopha death toll rises,False
1184,other_disaster,True,requests_or_needs,some of the most critical needs for families include food drinkable water medical care and hygiene supplies.,False
1185,hurricane,True,infrastructure_and_utilities_damage,a path of hurricane odiles destruction seen through instagram hurricane odile came ashore over cabo san lucas on sunday night as t...,True
1186,flood,True,affected_individual,slsc australia sls is encouraging everyone to play it safe in flood affected areas. don,True
1187,earthquake,True,infrastructure_and_utilities_damage,san francisco bay area assessing damage after large quake jobs news career jobsila,True
1188,flood,True,affected_individual,deadly 1000year floods strike colorado,True
1189,other_disaster,True,requests_or_needs,anyone to help me please see what you can do for me please i have no one they didnt show me any other family im so alone i have no idea what to do im praying god for,True
1190,other_disaster,True,requests_or_needs,we are in tomazo especially in la hatte cadette. we need water and food.,False
1191,typhoon,True,donation_and_volunteering,clusters mobilizing response to the worstaffected communities in support of the government. get the latest on bopha ...,False
1192,hurricane,True,affected_individual,yet puerto rico doesnt even have clean water yet,False
1193,wildfire,True,injured_or_dead_people,california wildfires kill couple married 75 years they went together,True
1194,other_disaster,True,requests_or_needs,a total of 150547 people received health assistance from these medical teams principally in relation to diarrhoea dysentry and acute respiratory infections.,False
1195,explosion,True,affected_individual,horrible news coming out of westtx the work of jp says he expects 17 dead in blast including 12 firefighters,True
1196,train_crash,True,affected_individual,at least 2 have died in train derailment in the bronx. metronorth via,False
1197,earthquake,True,donation_and_volunteering,from varanasi 236 nepali swayamsevaks reached to nepal to help injured nepalearthquake rss,True
1198,hurricane,True,infrastructure_and_utilities_damage,tornado activity in palm bay. a roof blew off a home and at least six mobile homes were destroyed,True
1199,hurricane,True,affected_individual,hurricane maria survivor back home in algiers,True
1200,shooting,True,affected_individual,lax update lapds west bureau and south bureau are in tactical alert due to the shooting,False
1201,earthquake,True,injured_or_dead_people,headlines 12 kenya begins westgatemall mourning period death toll grows in massive pakistan earthquake,True
1202,crash,True,affected_individual,update at least 8 dead and dozens injured in glasgow helicopter crash,True
1203,flood,True,affected_individual,severe floods and tornadoes in the australian state of queensland have left four people dead and a further two missin ...,True
1204,hurricane,True,donation_and_volunteering,icymi two westchesteroh fire officials deployed to hurricane irma in florida,True
1205,earthquake,True,donation_and_volunteering,donate to support cares earthquake relief teams on the ground now in nepal.,True
1206,other_disaster,True,requests_or_needs,i salutation this organization i need help waterfood and shelter. thanks for your comprehension,True
1207,other_disaster,True,requests_or_needs,we who are in mon repos 38 carrefour we need help because we arent in the crowd we never get anything please please put the message through for me,True
1208,earthquake,True,infrastructure_and_utilities_damage,62yro crawled out from under rubble of house she spent her life building. nepalquake,False
1209,train_crash,True,affected_individual,at least four killed in metronorth derailment,False
1210,earthquake,True,affected_individual,huge quake jolts costa rica two killed,False
1211,other_disaster,True,requests_or_needs,dinepa is it stop the water distribution at solino,False
1212,other_disaster,True,requests_or_needs,kenskoff commune. thanks we are already in kenskoff we dont have another place to go its assistance we need to help ourselves and all the piles of other people who came up,True
1213,cyclone,True,infrastructure_and_utilities_damage,cyclone olwyn cycloneolwyn cyclone olwyn recovery efforts hampered as critical infrastructure,False
1214,wildfire,True,infrastructure_and_utilities_damage,lithgow to bell bellslineofroad is open again in both directions after being closed due to nswfires earlier.,False
1215,earthquake,True,injured_or_dead_people,napa teen badly injured by a collapsed chimney is improving. napaquake,True
1216,hurricane,True,donation_and_volunteering,morgan students collected over 40 boxes of donations for hurticane harvey,True
1217,other_disaster,True,infrastructure_and_utilities_damage,some 30 cottages have collapsed and some have even been swept away by rapti river in deukhuri according to reports.,False
1218,tornado,True,injured_or_dead_people,slow recovery from tornado in kaukauna taking toll on residents when there is so much devastation it will take more than a few wee...,True
1219,hurricane,True,donation_and_volunteering,atlanta humane society creates makeshift shelter for fourlegged irma refugees,True
1220,earthquake,True,donation_and_volunteering,desperate search for survivors after powerful earthquake in mexico,True
1221,other_disaster,True,infrastructure_and_utilities_damage,what time do the schools open what do we do if the schools got destroyed,True
1222,other_disaster,True,infrastructure_and_utilities_damage,key expressways were closed in the disasterhit areas and severe traffic jams took place on some national trunkline highways and provincial trunklines.,False
1223,explosion,True,infrastructure_and_utilities_damage,what refinery in amuay looks like today. venezuela via al jazeera producer i ...,False
1224,other_disaster,True,requests_or_needs,do everything you can for us we are on a patch of land without food or shelter. please,True
1225,earthquake,True,affected_individual,sad news to report from guatemala at least 8 confirmed dead possibly more by this mornings major earthquake.,True
1226,flood,True,infrastructure_and_utilities_damage,watch house floats down river during alberta flood,True
1227,other_disaster,True,requests_or_needs,we need help on place maigate we need tentes and water also food. please foward the message for us because we havent received anythign yet,True
1228,hurricane,True,donation_and_volunteering,panthers magic helping communities recover after hurricane irma,True
1229,other_disaster,True,requests_or_needs,please help me i lost my family and i cant eat. i am on place boyer help me.,True
1230,other_disaster,True,requests_or_needs,a the distribution and amount of rain during the current main rainy season meher or kiremt rains which began on schedule in much of the country in late june is reported to be favourable so far and farmers are reported to have been encouraged to finalize input supply and land preparation.,False
1231,other_disaster,True,infrastructure_and_utilities_damage,an explosion occurred at ryongchon railway station in north phyongan pyongan province on april 22 due to the electrical contact caused by carelessness during the shunting of wagons loaded with ammonium nitrate fertilizer and tank wagons kcna said.,False
1232,other_disaster,True,injured_or_dead_people,pray for the people of peshawar. dozens are injured earthquake,True
1233,other_disaster,True,requests_or_needs,vitamin a iron and folate supplements and deworming tablets will be distributed and a project providing multiple micronutrient supplements known as sprinkles for children aged 659 months will be expanded.,False
1234,wildfire,True,affected_individual,la times parts of air force academy evacuated as colorado fire rages,True
1235,other_disaster,True,requests_or_needs,help us. .. pelerin 3 57 petion ville. there are 20 adults 3 babies and 5 children. we do not have water or food please help us,True
1236,hurricane,True,infrastructure_and_utilities_damage,wind blown debris from another house slicing thru the roof reallyharvey,False
1237,other_disaster,True,infrastructure_and_utilities_damage,the worst incident occurred on 1214 july with the unprecedented collapse of the gumti river embankment due to the rapid onrush of water from upstream.,False
1238,other_disaster,True,infrastructure_and_utilities_damage,13000 homes and businesses without power heres where is worst affected stormfrank,False
1239,other_disaster,True,requests_or_needs,in district jamshoro sindh village ali abad along with indus high way road there are two flood relief camps situated in primary schools from one week they are not receiving food and clean water for drinking so pleas do somethng for them about foo,True
1240,other_disaster,True,requests_or_needs,after every desaster the country knows everybody know that the national and the international commitee. how the help are browsing money food never find the true victim,True
1241,flood,True,donation_and_volunteering,dear followers who are not in the philippines please excuse my flooding. trying to do what i can to help my neighbors. rescueph,True
1242,earthquake,True,injured_or_dead_people,over 120 injured in napa quake via breitbart tcot,True
1243,hurricane,True,donation_and_volunteering,qatar giving 30 million to help harvey victims in texas read more victims politics,True
1244,other_disaster,True,requests_or_needs,i am in the tents at delmas 29. we have not been helped. we need aid.,True
1245,earthquake,True,affected_individual,philippines earthquake radio reports say 7.2mag. quake has killed at least 4 people in central philippines,True
1246,earthquake,True,injured_or_dead_people,witnesses say people are being buried without kafan many injured r dying bcoz of no relief. malik just paid a helicopter vis,True
1247,cyclone,True,donation_and_volunteering,last plug abc red cross cyclone pam vanuatu appeal. to donate go to or c,False
1248,earthquake,True,injured_or_dead_people,85 6.0 earthquake jolts bay area damage and at least 87 injuries reported earthquake it was t,True
1249,earthquake,True,requests_or_needs,newsvillages near nepal earthquakes epicenter are desperate as death toll tops ... new york times,True
1250,flood,True,donation_and_volunteering,tim hortons selling alberta rose donuts proceeds to flood victims. sounds like a good reason to eat 12 donuts for breakfas,True
1251,other_disaster,True,requests_or_needs,an emergency conference call today with fellow members of the partnership for quality medical donations which includes over a dozen healthcare companies and colleague humanitarian nonprofits confirmed all aid groups as well as governments are encountering the same obstacles.,True
1252,earthquake,True,injured_or_dead_people,update a sixth person has died following the earthquake off of chiles coast,True
1253,flood,True,injured_or_dead_people,jandk floods 7 lakh stranded in srinagar landslides in udhampur leave many dead srinagar jammu and kashmir i...,True
1254,other_disaster,True,requests_or_needs,please. we ask for urgent help for the population of fampak. we can no loger survive with misery. we are located in route de damien ruelle fampak in the fampak shelter in the neighbourhood.,True
1255,other_disaster,True,requests_or_needs,she said the agency feared that there will outbreaks of dysentery diarrhoea malaria and bilharzia in an area where children have been swimming in the floodwaters amidst human and animal waste.,True
1256,other_disaster,True,requests_or_needs,leogane is hardly hit we need water and food,False
1257,cyclone,True,infrastructure_and_utilities_damage,the island of vanuatu has been devastated by a monster cyclone a monster storm hit the pacific island natio...,False
1258,flood,True,injured_or_dead_people,45 dead hundreds of thousands stranded in indias odisha due to severe floods,True
1259,typhoon,True,requests_or_needs,one injured in odiongan romblon following a collision in brgy. tumingad. rubyph,True
1260,flood,True,donation_and_volunteering,indian soldiers taunt flood affected kashmiris to seek help from pakistan and on the other hand stops un and international,True
1261,earthquake,True,infrastructure_and_utilities_damage,before and after pictures of the nepal earthquake via,True
1262,typhoon,True,donation_and_volunteering,nicey..cancelling a christmas party to donate to pabloph victims. rhbill,True
1263,other_disaster,True,requests_or_needs,silver spring maryland when dangerous snow storms devastated chinas central southern and southwestern regions this winter the adventist development and relief agency adra responded immediately providing emergency relief assistance for nearly 5000 survivors in huoshan one of the areas most severely affected by the storm in the province of anhui in eastern china.,True
1264,other_disaster,True,affected_individual,from joy to tragedy inside the brazil nightclub where 233 died via,False
1265,earthquake,True,donation_and_volunteering,going 2 sakhu again tomo now we know need 2 help with relief. we have big truck we need tents water and blankets. help. ne,True
1266,train_crash,True,infrastructure_and_utilities_damage,downtown lacmegantic que. in flames after derailment . mayor says city centre destroyed.,True
1267,hurricane,True,donation_and_volunteering,puerto rico rescue work by the us coast guard. we are grateful. maga,True
1268,hurricane,True,donation_and_volunteering,maralago is in the evacuation zone for hurricane irma,True
1269,other_disaster,True,requests_or_needs,i have a lot of spots please help me,True
1270,other_disaster,True,requests_or_needs,a huge undersea earthquake off the aceh coast triggered the tsunami on dec. 26.,True
1271,hurricane,True,donation_and_volunteering,rebuilding our community. supporting harvey victims,True
1272,other_disaster,True,requests_or_needs,they have no access to clean or safe water toilets habitable shelter or adequate food which has prompted concerns about a possible increase in cases of malaria waterborne diseases and malnutrition.,True
1273,earthquake,True,donation_and_volunteering,dont forget your awaran mashkay brothers and sisters you can donate blood for quake victims call 03203202986 balochi,True
1274,earthquake,True,infrastructure_and_utilities_damage,dc awaran says several houses damaged due to latest earthquake dozens buried under rubble rescue work underway baloc,True
1275,explosion,True,infrastructure_and_utilities_damage,wow video of the explosion fertilizer plant explosion near waco texas,False
1276,other_disaster,True,requests_or_needs,i dont receive the humanitarian aid. petitgoave wislyne ave. libert,False
1277,hurricane,True,donation_and_volunteering,chainsawwielding nun helps clear irma debris,True
1278,other_disaster,True,requests_or_needs,we have no pot in which to boil our water. we have no water machine.,False
1279,other_disaster,True,requests_or_needs,please help us find a tent. its a family of 6 people. incomplete seems to be the end of a message,True
1280,other_disaster,True,requests_or_needs,it explained the unspent funds on the sheer volume of donations to nongovernment organisations.,True
1281,flood,True,infrastructure_and_utilities_damage,noble energy flooding closes 510 percent of colorado wells,True
1282,flood,True,donation_and_volunteering,i am grateful for the support of the house thanks for passing disaster relief for colorado. coflood cofloodrelief cg,True
1283,wildfire,True,donation_and_volunteering,sofi starts gofundme to aid their people impacted by california wildfire,True
1284,hurricane,True,infrastructure_and_utilities_damage,a semi truck floated into luckys pub during harvey flooding,True
1285,other_disaster,True,requests_or_needs,we are about 150 families still on the roads i assume no shelter in the area of mariani tete source 1 and 2 on the part of the road from morne to bateau i gressier.,True
1286,earthquake,True,affected_individual,7.2 quake hits central philippines killing 4 7.2magnitude quake hits central philippine island killing at ...,False
1287,other_disaster,True,requests_or_needs,wfp is presently helping to feed 720000 people in indonesia including more than 22000 people on the islands of nias and simeulue in the wake of a massive undersea earthquake on march 28.,True
1288,crash,True,affected_individual,correction family members confirm david traill was among the eight people killed in the helicopter crash in glasgow,False
1289,haze,True,donation_and_volunteering,this 7yr old american is actually trying to do something to stop e haze. unlike some who r paid millions. sghaze,False
1290,hurricane,True,donation_and_volunteering,hurricane harvey rescue dogs looking for new homes in connecticut,True
1291,earthquake,True,donation_and_volunteering,help children and families devastated by nepalearthquake by raising funds with your friends and family,True
1292,flood,True,infrastructure_and_utilities_damage,infrastructure recovery will be an arduous process long after the floodwaters recede coflood,True
1293,train_crash,True,donation_and_volunteering,people seeking information about family members involved in bronx train derailment should contact metro north at 718 81,False
1294,earthquake,True,infrastructure_and_utilities_damage,my heart aches and aches and aches,False
1295,other_disaster,True,infrastructure_and_utilities_damage,other towns and villages in the state are also battling power outages and other hardships.,False
1296,hurricane,True,donation_and_volunteering,donated supplies for irma victims sent off from mosquito lake on truck,True
1297,flood,True,donation_and_volunteering,donating 1 for every tweet of hashtag omgp to max 50k for yycflood spread the word.,True
1298,other_disaster,True,requests_or_needs,clinicians have opened 10 clinical practices in prison systems trained nurse midwives to screen for maternal depression treated refugees from the ivory coast conflict supported the nations first mental health consumer organization worked in ebola treatment units etus and provided psychosocial supports to individuals and families affected by the ebola virus.,False
1299,other_disaster,True,injured_or_dead_people,latest hurricane matthew death toll nears 900 in haiti,True
1300,other_disaster,True,requests_or_needs,a c17 and two c130 arrived on october 10 carrying relief supplies a 10ton forklift and two cargo handlers as well as a humanitarian coordination team.,False
1301,hurricane,True,donation_and_volunteering,volunteers help miamis poorest communities impacted by hurricane irma,True
1302,flood,True,injured_or_dead_people,india pakistan flood death toll exceeds 460,True
1303,other_disaster,True,infrastructure_and_utilities_damage,a government relief commission said that river nile floodwaters had disconnected the water electricity and other vital services and had isolated the town as well as destroying houses and public buildings rendering more than 50000 people homeless.,True
1304,hurricane,True,infrastructure_and_utilities_damage,harveys houston flooding will put urban coyotes feral hogs on the move,True
1305,flood,True,donation_and_volunteering,location for tomorrows green cleaning chemical donation pickup has changed. new location tbd. will update asap. yychelps yyc abflood,True
1306,flood,True,donation_and_volunteering,modi is helping muslim flood victims including professional stone pelters in kashmir kashmirfloods,True
1307,hurricane,True,infrastructure_and_utilities_damage,parque del indio condado before and after hurricane maria,True
1308,other_disaster,True,requests_or_needs,please bo gravel vob ta a 41 we are hungry. need food.,False
1309,other_disaster,True,requests_or_needs,additional earth movements of a serious magnitude are possible and humanitarian response activities are underway in drc and rwanda.,False
1310,other_disaster,True,requests_or_needs,the tni will also send one infantry unit from bireuen to simeulue by ship.,False
1311,flood,True,donation_and_volunteering,in addition to the colorado flooding redcross has provided food and shelter to people affected by flooding in guam ut az,True
1312,hurricane,True,donation_and_volunteering,three la. breweries plan weekend fundraiser for harvey victims,True
1313,hurricane,True,infrastructure_and_utilities_damage,few more photos of damage left by hurricane odile in cabo san lucas.,True
1314,flood,True,donation_and_volunteering,blasted rain. lets help those affected gt for maringph text donations redltspacegtamount to 2899 globe,True
1315,shooting,True,affected_individual,fuck breaking police lax shooter opened fire with assault rifle,False
1316,hurricane,True,donation_and_volunteering,donate 5 win 60 amazon gc we can do 10k for hurricaneharvey,True
1317,earthquake,True,infrastructure_and_utilities_damage,quake jolts california wine region via,False
1318,other_disaster,True,requests_or_needs,extensive food shortages caused by four years of erratic and unreliable rainfall have affected the population of 17 districts in turkana.,False
1319,other_disaster,True,infrastructure_and_utilities_damage,on sunday a mi17 helicopter from the siachen tigers got airborne from mohanbari and landed at a makeshift helipad made by marking h on the national highway bypass of assams tinsukia town after blocking the road from both sides.,False
1320,crash,True,donation_and_volunteering,experts are to begin examining the police helicopter which crashed into the clutha pub in glasgow on friday night.,False
1321,typhoon,True,infrastructure_and_utilities_damage,bbc news philippinen typhoon hagupit makes landfall as thousands flee,False
1322,earthquake,True,donation_and_volunteering,pakistan earthquake update has arranged for the delivery of highenergy biscuits to the affected people,True
1323,earthquake,True,injured_or_dead_people,icymi read about this brampton womans journey through nepal during the earthquake that killed upwards of 4000,True
1324,other_disaster,True,requests_or_needs,the crm together with the local civil authorities has helped the french governments action humanitaire france with erecting tents to provide shelter for the homeless.,True
1325,hurricane,True,infrastructure_and_utilities_damage,harvey flooding damage likely to cost tens of billions of money,True
1326,wildfire,True,infrastructure_and_utilities_damage,view of springwood fire looking toward winmalee from warrimoo oval nswfires nswrfs,False
1327,other_disaster,True,requests_or_needs,i dont even have clothes to wear.,False
1328,earthquake,True,injured_or_dead_people,120 injured 3 critical after napa california quake via,True
1329,earthquake,True,injured_or_dead_people,may allah have mercy on all those died in the earthquake that hit pakistan. 275 died and many more injured,True
1330,cyclone,True,affected_individual,as another night draws close the thousands of people affected by cyclonepam are uppermost in our minds. retweet this,False
1331,typhoon,True,donation_and_volunteering,typhoon bopha oxfam rolls out emergency response for towns completely devastated in southern mindanao phl ...,True
1332,other_disaster,True,infrastructure_and_utilities_damage,yes same here flood and cyclone both come 2,True
1333,earthquake,True,donation_and_volunteering,relief workers security officials attacked with guns rockets while trying to reach pakistan earthquake victims,True
1334,other_disaster,True,requests_or_needs,e despite these logistic difficulties wfp is providing food assistance to all but one of the 42 reception areas for former unita soldiers and their families.,False
1335,other_disaster,True,requests_or_needs,in the eastern state of bihar thousands of homeless people crowded around bonfires as temperatures hovered around 6 degrees celsius.,False
