index,event,disaster,class_label,clean_text,has_crisis_term
2357,other_disaster,True,infrastructure_and_utilities_damage,wreckage and debris along dayton beach shores following hurricane matthew storm surge nn,True
2358,hurricane,True,donation_and_volunteering,how to help hurricane maria victims donations volunteer,True
2359,earthquake,True,infrastructure_and_utilities_damage,usa news hot news 494 earthquake damage from northern california earthquake could reach 1 billion earthquake u,True
2360,other_disaster,True,infrastructure_and_utilities_damage,damaged dams roads and bridges should be rebuilt and the resurgence of blackflies aphids which infest beans sugar beet and other plants should be,True
2361,other_disaster,True,requests_or_needs,business day quoted a new report from the investment company ing barings which said that the epidemic will cut south africas annual growth rate by 0.30.4 percentage points over the next 15 years.,False
2362,earthquake,True,donation_and_volunteering,how to help earthquake victims in nepal via,True
2363,flood,True,infrastructure_and_utilities_damage,mora impact port city sees heavy rain waterlogging tisnews click link,False
2364,other_disaster,True,affected_individual,latest on bangladesh survivor found after 17 days identified as reshma taken to military hospital.,True
2365,earthquake,True,donation_and_volunteering,balochistan is looking for help. awaran pakistan earthquake,True
2366,earthquake,True,requests_or_needs,chileans scramble for supplies after new quake yahoo news uk via,False
2367,other_disaster,True,infrastructure_and_utilities_damage,episcopal relief and development is providing critical support to help the hospital procure fuel to operate its generator and steam boiler.,True
2368,other_disaster,True,requests_or_needs,in addition wfp assisted 2300 vulnerable people facing severe food shortages in isolated areas recently affected by a snowstorm.,False
2369,earthquake,True,injured_or_dead_people,chiles interior minister rodrigo penailillo says five people have died in the 8.2 magnitude quake chilequake,False
2370,other_disaster,True,requests_or_needs,u267b oxfamnz oxfam is already on the ground in haiti after 7.0 magnitude earthquake hits. you can help now please donate http tr.im kewz,True
2371,wildfire,True,donation_and_volunteering,please . colorado springs is suffering badly from a large forest fire. text the word redcross for a 10 donation. thank you,True
2372,other_disaster,True,requests_or_needs,map international is accepting cash donations to assist with its medical relief response to those devastated by the tsunami.,True
2373,flood,True,donation_and_volunteering,love the shout out on nenshilive such a great place to donate to support yyc yycflood yychelps,True
2374,explosion,True,affected_individual,200 injured in texas fertilizer plant explosion,True
2375,earthquake,True,donation_and_volunteering,rescuers search collapsed school after mexico earthquake,True
2376,hurricane,True,donation_and_volunteering,nationwide telethon will raise funds for victims of harvey irma,True
2377,hurricane,True,donation_and_volunteering,fema approves loans to keep harvey damaged cities working to repair damage,True
2378,other_disaster,True,requests_or_needs,willing to give out water supplies etc .,False
2379,earthquake,True,injured_or_dead_people,pakistan deadly bomb blast kills dozens in peshawar theguardiancom worldnews news taliban,True
2380,earthquake,True,donation_and_volunteering,gift of the givers to assist quakestricken nepal,False
2381,wildfire,True,donation_and_volunteering,help salvationarmy assist disaster survivors t.s. debby and colorado wildfires ...,True
2382,other_disaster,True,requests_or_needs,amid scenes of desperation in balakot world vision distributed burial shrouds quilts and water wednesday october 12 to pakistani survivors of the worst quake ever to hit the country.,True
2383,hurricane,True,affected_individual,aaand its the twtwo brothers aagainst the hurricane tornado with with flyflying shsharks 2,True
2384,hurricane,True,donation_and_volunteering,florida realtors brace for irmas wrath,False
2385,earthquake,True,injured_or_dead_people,bjprajnathsingh ndrf has rescued 11 individuals recovered 67 dead bodies and evacuated more than 1000 people in nepal. thankyoupm bjp,True
2386,other_disaster,True,requests_or_needs,latrines washroom kits purification tablets and hygiene kits to 4500 households,False
2387,flood,True,affected_individual,just saw a c117 on approach for yyc. caf yycflood,True
2388,other_disaster,True,requests_or_needs,the red cross society of china has sent disaster relief materials to the quakehit region in yingjiang county in southwest chinas yunnan province to offer assistant work on 10th march.,False
2389,other_disaster,True,infrastructure_and_utilities_damage,it has bee two years now when on 8th october 2005 an earthquake jolted kashmirand four districts of nwfp causing a rigorous damage to the life and property of the people.,True
2390,hurricane,True,donation_and_volunteering,ideas on how to assist puerto rico puertorico puertoricorelief,False
2391,earthquake,True,infrastructure_and_utilities_damage,wow the damage big chunk of the maxwellbridge in napa tvcamera used for scale napaquake,True
2392,other_disaster,True,requests_or_needs,ccfs development projects are designed to improve nutrition decrease child mortality rates create access to safe water and sanitary waste disposal introduce childhood development programs provide mass immunization programs teach improved agricultural practices and initiate family incomegenerating projects.,False
2393,hurricane,True,infrastructure_and_utilities_damage,along with puerto rico hurricane maria left u.s. virgin islands in ruins after it swept through caribbean last week,True
2394,typhoon,True,donation_and_volunteering,the victims of typhoon haiyan need your help. help them with a donation at churpforph,True
2395,other_disaster,True,requests_or_needs,kot addu medicines are most crucial requirement than food.,False
2396,hurricane,True,donation_and_volunteering,fema the sba plus other state and local agencies are looking for volunteers to help out postharvey and irma.,True
2397,hurricane,True,infrastructure_and_utilities_damage,rooms to go commits 2m over 2000 rooms of furniture to those affected by hurricanes irma,True
2398,other_disaster,True,requests_or_needs,what can we do when we see the earthquaque,False
2399,earthquake,True,donation_and_volunteering,thanks for donating 100000 to the stayhopefulnepal nepalearthquake,True
2400,hurricane,True,infrastructure_and_utilities_damage,webcam at looks awfully midwestern with a tornado warned storm over tahoe,True
2401,earthquake,True,donation_and_volunteering,pakistanarmy kicks off rescue operations in earthquake hit areas of balochistan.,True
2402,cyclone,True,donation_and_volunteering,vanuatu president calls for help after cyclone destruction bbc news bbc newsvanuatu president calls for hel...,True
2403,flood,True,infrastructure_and_utilities_damage,plz public schools cbe and catholic will be closed on monday. yyc yycflood,True
2404,other_disaster,True,requests_or_needs,the londonbased humanitarian organisation oxfam said it was providing those affected with temporary shelter water purification tablets buckets and oral rehydration sachets.,True
2405,other_disaster,True,infrastructure_and_utilities_damage,missinng my family taking care off everyone missing santiago s i want to be there no airport,False
2406,other_disaster,True,requests_or_needs,we are amachu a humanitarian organization working in delmas 75. we need aid because so many people have no food or water.,False
2407,train_crash,True,affected_individual,photo breakingnews dozens killed in train wreck in spain reuters the estimate of the death toll from the...,False
2408,other_disaster,True,requests_or_needs,please send us information concerning them.,False
2409,hurricane,True,infrastructure_and_utilities_damage,hurricane harvey evacuees are returning home to face destruction its sickening,True
2410,other_disaster,True,requests_or_needs,i would like to know when the aftershocks are going to end. thank you. willy,False
2411,other_disaster,True,requests_or_needs,breaking news usain bolt donate 10 million dollars to haiti after hurricane matthew,True
2412,flood,True,donation_and_volunteering,uerm hospital brownout and icu patients on generator generators about to die rescueph someone help them pls,True
2413,hurricane,True,infrastructure_and_utilities_damage,harvey strikes blow at houston real estate market,False
2414,flood,True,donation_and_volunteering,wv is accepting donations to provide water foodand health services affected by maringph,True
2415,earthquake,True,donation_and_volunteering,dear tweeps people of nepal still need your help amplify the voices of those on the ground to help with relief efforts.,True
2416,earthquake,True,injured_or_dead_people,nepalquake an estimated 4.6 million people were exposed to the earthquake shaking,True
2417,other_disaster,True,requests_or_needs,village sehta sench union council channa taluka sehwan district jamshoro 2 months have passed since flood water came in our villageno any aid has come to us except few un helicopters that had thrown wheat flour and biscuits during the very begining a,True
2418,earthquake,True,affected_individual,at least 8 people reported dead following earthquake off pacific coast of guatemala,True
2419,hurricane,True,donation_and_volunteering,so adorable. young boy treats irma evacuee to chickfila,False
2420,hurricane,True,infrastructure_and_utilities_damage,reports suggest hurricane harvey cars could be on its way to nigeria,True
2421,hurricane,True,infrastructure_and_utilities_damage,pics of the destruction from hurricaneharvey 2 weeks after the storm. titff campdelta,True
2422,flood,True,donation_and_volunteering,up campuses in diliman and manila should be opened as evacuation centers for families affected by floods. upm dss chair ...,True
2423,other_disaster,True,infrastructure_and_utilities_damage,hurricane maria blasts puerto rico with damaging winds major flooding dominican republic turks and caicos...,True
2424,wildfire,True,infrastructure_and_utilities_damage,a winmalee house thermometer melted due to the intensity of the flames. nswfires,False
2425,other_disaster,True,requests_or_needs,we are located in rue jean charles fort national. we are 514 people. we need aid. food water and medication.,False
2426,other_disaster,True,injured_or_dead_people,the boy soldier casualties of yemens war via,False
2427,hurricane,True,donation_and_volunteering,tracking harvey storm continues to weaken as relief efforts gain momentum,False
2428,flood,True,donation_and_volunteering,jandk floods pm modi asks for faster rescue ops as lakhs wait for help kashmirfloods,True
2429,earthquake,True,infrastructure_and_utilities_damage,earthquake is major test for hardluck california city the historic bluecollar town of vallejo is a short di...,True
2430,typhoon,True,infrastructure_and_utilities_damage,roadalert. gandara bypass rd going to catbalogan samar. unpassable to all vehicles. river overflowed waist deep. rub,False
2431,earthquake,True,infrastructure_and_utilities_damage,insured loss estimates for mexico earthquake up to 2bn,True
2432,not_disaster,False,non-disaster,So glad that Trying out a new pottery class today. Molding clay on the wheel is difficult but extremely therapeutic. Love it.,False
2433,not_disaster,False,non-disaster,Just wanted to share: What an exciting football match tonight! The underdog team scored in the final minutes to win the championship. Perfect.,False
2434,not_disaster,False,non-disaster,"Just wanted to share: The design of this application is amazing. Very clean typography, subtle micro-animations, and a beautiful dark mode. Love it.",False
2435,not_disaster,False,non-disaster,So glad that Organizing my study room and clearing out old files. A clean and tidy workspace makes me feel so much more productive. Love it.,False
2436,not_disaster,False,non-disaster,"Honestly, Great basketball game today. Both teams played with incredible energy and the defense was top-notch. Recommended.",False
2437,not_disaster,False,non-disaster,Just thinking that Organizing my study room and clearing out old files. A clean and tidy workspace makes me feel so much more productive. Love it.,False
2438,not_disaster,False,non-disaster,Really enjoying this. Brewing a fresh pot of single-origin coffee this morning. The aroma is the absolute best way to wake up. #blessed,False
2439,not_disaster,False,non-disaster,"Today was great! A quiet morning sitting on the balcony, watching the birds and enjoying the fresh morning breeze.",False
2440,not_disaster,False,non-disaster,Really enjoying this. Highly satisfied with the new mechanical keyboard I bought. The tactile feedback and typing sounds are extremely satisfying. Highly satisfied.,False
2441,not_disaster,False,non-disaster,"Honestly, Enjoying a refreshing fruit smoothie after a long workout. Packed with fresh berries, spinach, and protein. What a day!",False
2442,not_disaster,False,non-disaster,"Wow, Met up with an old high school friend for coffee today. It was wonderful catching up and sharing stories. :)",False
2443,not_disaster,False,non-disaster,"Honestly, Setting up a freshwater aquarium today. Adding some beautiful green plants and colorful neon tetra fish. What a day!",False
2444,not_disaster,False,non-disaster,"Wow, What an exciting football match tonight! The underdog team scored in the final minutes to win the championship. What a day!",False
2445,not_disaster,False,non-disaster,So glad that Just finished building a custom desktop PC! Cable management was tough but the final result looks super clean. Highly satisfied.,False
2446,not_disaster,False,non-disaster,"Just thinking that A quiet morning sitting on the balcony, watching the birds and enjoying the fresh morning breeze. Perfect.",False
2447,not_disaster,False,non-disaster,Today was great! Visiting the historic ruins in Rome. It is incredible how well these ancient structures have survived. #blessed,False
2448,not_disaster,False,non-disaster,Just wanted to share: Excited about the progress being made in open source software. It empowers developers around the world to build better tools. Love it.,False
2449,not_disaster,False,non-disaster,"Honestly, Had the most amazing dark chocolate gelato today. It was rich, creamy, and not too sweet.",False
2450,not_disaster,False,non-disaster,Just thinking that Spent a quiet afternoon reading historical biographies at the local library. So much fascinating history to learn. Love it.,False
2451,not_disaster,False,non-disaster,Just thinking that Road trip along the Pacific Coast Highway! Beautiful ocean breeze and infinite winding roads. Recommended.,False
2452,not_disaster,False,non-disaster,So glad that Walking my dog in the park this evening. He loves chasing after tennis balls and meeting other friendly dogs. Recommended.,False
2453,not_disaster,False,non-disaster,Just thinking that Swimming laps at the community pool is a great low-impact workout. It leaves me feeling energized for the day. Perfect.,False
2454,not_disaster,False,non-disaster,Just thinking that Brewing a fresh pot of single-origin coffee this morning. The aroma is the absolute best way to wake up. Perfect.,False
2455,not_disaster,False,non-disaster,Quick update: Spent a quiet afternoon reading historical biographies at the local library. So much fascinating history to learn. What a day!,False
2456,not_disaster,False,non-disaster,"Wow, A quiet morning sitting on the balcony, watching the birds and enjoying the fresh morning breeze. Love it.",False
2457,not_disaster,False,non-disaster,Just thinking that What an exciting football match tonight! The underdog team scored in the final minutes to win the championship. Can't complain!,False
2458,not_disaster,False,non-disaster,"Wow, Great basketball game today. Both teams played with incredible energy and the defense was top-notch. Highly satisfied.",False
2459,not_disaster,False,non-disaster,Swimming laps at the community pool is a great low-impact workout. It leaves me feeling energized for the day. Highly satisfied.,False
2460,not_disaster,False,non-disaster,"Wow, Hiking the Swiss Alps is challenging but the snowy mountain peaks make every single step worth it. Love it.",False
2461,not_disaster,False,non-disaster,Quick update: Planning my next trip to Tokyo. I want to visit the historic temples and try the amazing sushi places. Love it.,False
2462,not_disaster,False,non-disaster,"Honestly, The new flagship smartphone was just announced today! The camera upgrades and battery life improvements look fantastic.",False
2463,not_disaster,False,non-disaster,"Honestly, Enjoying a relaxing weekend getaway at a cozy cabin in the woods. Reading by the fireplace. :)",False
2464,not_disaster,False,non-disaster,Today was great! Learning to play a classic classical song on the acoustic guitar. It is challenging but highly rewarding. Perfect.,False
2465,not_disaster,False,non-disaster,"Wow, Trying out a new pottery class today. Molding clay on the wheel is difficult but extremely therapeutic. What a day!",False
2466,not_disaster,False,non-disaster,Quick update: Visiting the historic ruins in Rome. It is incredible how well these ancient structures have survived. #blessed,False
2467,not_disaster,False,non-disaster,Just wanted to share: Learning to play a classic classical song on the acoustic guitar. It is challenging but highly rewarding. What a day!,False
2468,not_disaster,False,non-disaster,Today was great! Great basketball game today. Both teams played with incredible energy and the defense was top-notch. :),False
2469,not_disaster,False,non-disaster,Quick update: Brewing a fresh pot of single-origin coffee this morning. The aroma is the absolute best way to wake up. Recommended.,False
2470,not_disaster,False,non-disaster,"Honestly, Watched an amazing tennis match yesterday. The rallies were incredibly long and full of spectacular shots.",False
2471,not_disaster,False,non-disaster,"Today was great! Starting a small indoor herb garden on the windowsill. Planting fresh basil, rosemary, and thyme. :)",False
2472,not_disaster,False,non-disaster,Today was great! Planning my next trip to Tokyo. I want to visit the historic temples and try the amazing sushi places. Perfect.,False
2473,not_disaster,False,non-disaster,Just wanted to share: I love the cozy feeling of a rainy day when you can just stay indoors with a good book and a warm blanket. Highly satisfied.,False
2474,not_disaster,False,non-disaster,"Honestly, Attended an inspiring virtual tech conference on artificial intelligence and neural networks. The future is exciting. What a day!",False
2475,not_disaster,False,non-disaster,"So glad that Enjoying a refreshing fruit smoothie after a long workout. Packed with fresh berries, spinach, and protein. Life is good.",False
2476,not_disaster,False,non-disaster,Today was great! Great yoga session this evening. It really helps me stretch out my muscles and clear my mind after a busy week. What a day!,False
2477,not_disaster,False,non-disaster,So glad that Trying out a new pottery class today. Molding clay on the wheel is difficult but extremely therapeutic. What a day!,False
2478,not_disaster,False,non-disaster,"Honestly, Taking some time to write down my goals for the upcoming month. It helps keep me focused and motivated. Recommended.",False
2479,not_disaster,False,non-disaster,Just thinking that Just signed up for a half marathon next month! Time to start a structured training plan and build endurance. Perfect.,False
2480,not_disaster,False,non-disaster,"Wow, A hot bowl of chicken noodle soup is so comforting on a chilly rainy evening like this one. Can't complain!",False
2481,not_disaster,False,non-disaster,So glad that Walking through the quiet canals of Venice. It feels like stepping straight back into history. Perfect.,False
2482,not_disaster,False,non-disaster,"Wow, I love the cozy feeling of a rainy day when you can just stay indoors with a good book and a warm blanket. What a day!",False
2483,not_disaster,False,non-disaster,Learning to play a classic classical song on the acoustic guitar. It is challenging but highly rewarding. Highly satisfied.,False
2484,not_disaster,False,non-disaster,"Wow, Watched an amazing tennis match yesterday. The rallies were incredibly long and full of spectacular shots. Life is good.",False
2485,not_disaster,False,non-disaster,"Wow, Just upgraded my computer with a new graphics card. Games are running at ultra settings with incredibly high frame rates. :)",False
2486,not_disaster,False,non-disaster,Really enjoying this. Trying out a new pottery class today. Molding clay on the wheel is difficult but extremely therapeutic. Love it.,False
2487,not_disaster,False,non-disaster,"Wow, Watched an amazing tennis match yesterday. The rallies were incredibly long and full of spectacular shots. Can't complain!",False
2488,not_disaster,False,non-disaster,"Honestly, Learning to play a classic classical song on the acoustic guitar. It is challenging but highly rewarding. Perfect.",False
2489,not_disaster,False,non-disaster,Quick update: Brewing a fresh pot of single-origin coffee this morning. The aroma is the absolute best way to wake up. Recommended.,False
2490,not_disaster,False,non-disaster,Quick update: Baking homemade sourdough bread today. The kitchen smells amazing and the crust has a perfect golden crunch. Highly satisfied.,False
2491,not_disaster,False,non-disaster,Met up with an old high school friend for coffee today. It was wonderful catching up and sharing stories.,False
2492,not_disaster,False,non-disaster,So glad that Beautiful starry night tonight. The sky is perfectly clear and you can see so many bright constellations. What a day!,False
2493,not_disaster,False,non-disaster,"Honestly, The view from the top of the Eiffel Tower was absolutely breathtaking. I highly recommend visiting early in the morning.",False
2494,not_disaster,False,non-disaster,Setting up a freshwater aquarium today. Adding some beautiful green plants and colorful neon tetra fish. Love it.,False
2495,not_disaster,False,non-disaster,Trying out a new coding framework today. It simplifies state management and cuts down on boilerplate code significantly. #blessed,False
2496,not_disaster,False,non-disaster,Really enjoying this. The view from the top of the Eiffel Tower was absolutely breathtaking. I highly recommend visiting early in the morning. What a day!,False
2497,not_disaster,False,non-disaster,Setting up a freshwater aquarium today. Adding some beautiful green plants and colorful neon tetra fish.,False
2498,not_disaster,False,non-disaster,"Just thinking that The design of this application is amazing. Very clean typography, subtle micro-animations, and a beautiful dark mode. Can't complain!",False
2499,not_disaster,False,non-disaster,Really enjoying this. Brewing a fresh pot of single-origin coffee this morning. The aroma is the absolute best way to wake up. What a day!,False
2500,not_disaster,False,non-disaster,Just wanted to share: Road trip along the Pacific Coast Highway! Beautiful ocean breeze and infinite winding roads. Love it.,False
2501,not_disaster,False,non-disaster,Taking some time to write down my goals for the upcoming month. It helps keep me focused and motivated. Recommended.,False
2502,not_disaster,False,non-disaster,Today was great! Great basketball game today. Both teams played with incredible energy and the defense was top-notch. Life is good.,False
2503,not_disaster,False,non-disaster,Really enjoying this. Working on a new knitting project. Making a cozy wool scarf for the upcoming cold winter season. Recommended.,False
2504,not_disaster,False,non-disaster,The new flagship smartphone was just announced today! The camera upgrades and battery life improvements look fantastic. Highly satisfied.,False
2505,not_disaster,False,non-disaster,"Really enjoying this. A quiet morning sitting on the balcony, watching the birds and enjoying the fresh morning breeze. :)",False
2506,not_disaster,False,non-disaster,So glad that Excited about the progress being made in open source software. It empowers developers around the world to build better tools. :),False
2507,not_disaster,False,non-disaster,"Honestly, Enjoying a peaceful afternoon of golf with friends. The weather is absolutely perfect for being on the course. :)",False
2508,not_disaster,False,non-disaster,Just wanted to share: Excited about the progress being made in open source software. It empowers developers around the world to build better tools. Life is good.,False
2509,not_disaster,False,non-disaster,Had a delicious brunch today. Freshly toasted avocado bread with poached eggs and a hot caramel macchiato. Love it.,False
2510,not_disaster,False,non-disaster,Just thinking that Trying out a new pottery class today. Molding clay on the wheel is difficult but extremely therapeutic. Love it.,False
2511,not_disaster,False,non-disaster,"Wow, Planning my next trip to Tokyo. I want to visit the historic temples and try the amazing sushi places. Highly satisfied.",False
2512,not_disaster,False,non-disaster,Just wanted to share: The bakery down the street has the best croissants. They are incredibly flaky and buttery. Perfect.,False
2513,not_disaster,False,non-disaster,"Just wanted to share: Starting a small indoor herb garden on the windowsill. Planting fresh basil, rosemary, and thyme. Perfect.",False
2514,not_disaster,False,non-disaster,"Wow, Learning how to make authentic Indian curry from scratch. The spice blend smells absolutely heavenly. Life is good.",False
2515,not_disaster,False,non-disaster,"A quiet morning sitting on the balcony, watching the birds and enjoying the fresh morning breeze. #blessed",False
