index,event,disaster,class_label,clean_text,has_crisis_term
0,other_disaster,True,requests_or_needs,people in central of haiti need help. overcrowded cities,True
1,earthquake,True,injured_or_dead_people,very sad news 2 consecutive blasts in qisa khawani bazar in peshawar pakistan currently reported dead 33...,True
2,hurricane,True,donation_and_volunteering,heres how cfb teams are responding to hurricane irma,True
3,other_disaster,True,requests_or_needs,were hungry we need some food and water please,False
4,other_disaster,True,requests_or_needs,medicine and tent needed. we are counting on your assistance because people are asking us to find this stuff for them. a hot plate of food per day. thank you.,False
5,hurricane,True,donation_and_volunteering,thank you for your generosity. supporting families affected by hurricane harvey. ccsd93,True
6,other_disaster,True,requests_or_needs,please . .. we are in leogane we have not got water or tent or food please. .. we ok thanks in advace send me an answer,False
7,other_disaster,True,infrastructure_and_utilities_damage,although the wet season was supposed to have ended in march heavy rain fell near the south jakartatangerang border in bintaro and bumi serpong damai on thursday causing flooding as high as 40 centimeters on the toll road linking the two residential areas.,True
8,flood,True,donation_and_volunteering,dropin has evacuated to 4804 edmtrail ne need pillows and blankets yychelps yycfloods,True
9,other_disaster,True,injured_or_dead_people,hurricanematthew haiti south 90 destroyed and nearly 900 people killed. were providing safe water and supplies,True
10,earthquake,True,donation_and_volunteering,3 million children are in danger after nepalearthquake. join us in helping keep them safe. donate here,True
11,wildfire,True,infrastructure_and_utilities_damage,usa napa valley vineyards and wineries hit hard by california wildfires,True
12,hurricane,True,injured_or_dead_people,two people found dead in brooklyn tuesday morning crushed by giant trees sandy,True
13,other_disaster,True,requests_or_needs,food shortages this year have been blamed on last year floods which hit half of the countrys 27 districts and the export of 60000 tons of maize to kenya from strategic grain reserves.,True
14,hurricane,True,infrastructure_and_utilities_damage,pics from facebook page st. croix hurricane maria check in. extensive damage maria,True
15,earthquake,True,donation_and_volunteering,how does helping mexicoquake victims sound,True
16,other_disaster,True,requests_or_needs,please help me i have nothing to live since 12 january 2010 i am thhursty and hungry,True
17,earthquake,True,affected_individual,news from 10 dead in northern italys 5.8magnitude quake.,True
18,other_disaster,True,requests_or_needs,this is for and many many more who are working real hard on twitter for chennai,False
19,other_disaster,True,requests_or_needs,it has been more than 2 weeks since i been sleeping on the streets,False
20,other_disaster,True,requests_or_needs,the embassy said most of the assistance has been channeled through the us agency for international development usaid and its disaster assistance relief team.,False
21,other_disaster,True,requests_or_needs,we dont find any help in our generalcatelwhat can you do for us in thissituation,True
22,flood,True,affected_individual,rescueph please fellow speducator jaja vagilia and her family needs rescue 3 sampaguita st. ivc marikina ...,True
23,flood,True,injured_or_dead_people,deadly monsoon hits india nepal dozens of people have been kill...,True
24,earthquake,True,donation_and_volunteering,un ready to assist quakehit people balochistan pakistan,False
25,hurricane,True,infrastructure_and_utilities_damage,more than 10 600 homes affected by hurricane irma in sancti spiritus,True
26,hurricane,True,donation_and_volunteering,. relief hurricanemaria locals coming for safewater filling drums in the back of the truck,True
27,hurricane,True,donation_and_volunteering,prayers for all the people affected n hurting due to hurricaneharvey f,True
28,wildfire,True,infrastructure_and_utilities_damage,news startling footage shows california wildfire impact,True
29,other_disaster,True,requests_or_needs,the afghanistan interim authority aia planning figure is 20000 families and 15000 tents have been distributed or are en route.,False
30,hurricane,True,donation_and_volunteering,pouring for a cause join us at this fundraiser for irma victims. tix are only 35 available at,True
31,hurricane,True,donation_and_volunteering,publicprivate information portal developed to aid in hurricane harvey efforts,True
32,earthquake,True,injured_or_dead_people,september 30 1988. more than 250 innocent people were shot dead in 5 minutes hyderabadmassacre pakistan,True
33,other_disaster,True,requests_or_needs,at the time of our visit the frigid weather had prompted the distribution of firewood and quilts to each family.,False
34,other_disaster,True,affected_individual,apocalyptic storm floods sardinia 17 dead by nicole... costasmeralda follownicolewinfield markssquare,True
35,flood,True,infrastructure_and_utilities_damage,attn the upper deck of the centre st. bridge is closed. yycflood,True
36,other_disaster,True,requests_or_needs,i am a victim please help me any way you are able. i am in the northwest exactly. my family i cant call ..,True
37,flood,True,affected_individual,flooding from fastmoving storm in colorado kills two people and leads to the evacuation of hundreds of homes,True
38,cyclone,True,infrastructure_and_utilities_damage,news over 90 houses destroyed as monster cyclone pam struck vanuatu zee news,True
39,flood,True,injured_or_dead_people,check out this article from . 180 dead as floods wash away homes in nepal india,True
40,explosion,True,affected_individual,getting live updates from on this waco texas explosion crazy,False
41,other_disaster,True,requests_or_needs,the storm is moving northeastward at 20 km per hour and may leave zhejiang saturday morning or further weaken according to the zhejiang meteorological center.,False
42,hurricane,True,donation_and_volunteering,puerto rico governor more needed but feds have answered our calls,False
43,other_disaster,True,requests_or_needs,pakistan air force has delivered 163000 kg of relief cargo including tents blankets dry ration medicines in the disaster stricken muzaffarabad and adjacent areas during last six days.the relief activities was undertaken by various paf transport aircrafts that include y12 c130 casa and mi17 helicopters.,False
44,hurricane,True,donation_and_volunteering,ray of light cus organizations offer aid to harvey victims creditunions,True
45,shooting,True,affected_individual,reportlax shooter is a rightwing conspiracy kook. no surprise.,False
46,flood,True,infrastructure_and_utilities_damage,blog the latest on our services in flood affected qld bigwet,True
47,cyclone,True,donation_and_volunteering,cyclonehit vanuatu appeals for help,True
48,hurricane,True,infrastructure_and_utilities_damage,irmas price tag likely more than 100 million in georgia.,False
49,other_disaster,True,requests_or_needs,when the responsable will give us the information about the volcano,False
50,other_disaster,True,requests_or_needs,i am at la plain marin 22 imp. desmond 2. i am hungry and dying,False
51,hurricane,True,infrastructure_and_utilities_damage,just 1 pic of the damage done to my optometry school by hurricane maria in ....,True
52,hurricane,True,affected_individual,nearly 3.5 million customers impacted by hurricaneirma have had their power restored amazing work,True
53,typhoon,True,requests_or_needs,situation report per region and govt agency on rubyph,False
54,other_disaster,True,requests_or_needs,one person can make a difference and everyone should try.nso please donate something for haiti people at,False
55,other_disaster,True,requests_or_needs,will the state being help to survivors in gonaives because since 13 j message cut off,True
56,tornado,True,donation_and_volunteering,this week in college news tornado relief rotc and rebecca black college highered,True
57,typhoon,True,affected_individual,ndrrmc as of 10am325 dead 411 injured 379 missing 181k persons in evacuation centers. pabloph via,True
58,hurricane,True,donation_and_volunteering,collection centers for odile disasteraffected help loscabos,True
59,other_disaster,True,requests_or_needs,we living in the national school 28we waiting your help such as foodwatertent. thank youi wait your help.,True
60,train_crash,True,affected_individual,77 dead after train derails in spain a passenger train derailed as it hurtled around a curve in northwestern...,True
61,hurricane,True,infrastructure_and_utilities_damage,hurricane harvey fears of flash floods as 40 inches of rain... via telegraph,True
62,earthquake,True,infrastructure_and_utilities_damage,collapsed buildings in mexico city earthquake edificios colapsados terremoto,True
63,hurricane,True,infrastructure_and_utilities_damage,wild video hawk hitches ride in houston cab during harvey hurricaneharvey gtgt,True
64,flood,True,donation_and_volunteering,teambrianmundial pakistani troops expand rescue in floodhit areas pakistani troops ex... teambrianmundial,True
65,other_disaster,True,requests_or_needs,petit goave 1 needs food. where can we sleep. please were asking not take years because we cant survive,False
66,earthquake,True,donation_and_volunteering,help reach children in nepal. donate to support the nepalearthquake appeal,True
67,other_disaster,True,requests_or_needs,good evening please help us we are in croix des bouquests fort drago street we dont have. ..,True
68,train_crash,True,affected_individual,a train derailed in new york killing 4 and injuring dozens of people.,False
69,earthquake,True,donation_and_volunteering,canadian govt will match dollarfordollar for donations contributed to the nepalearthquake. help now,True
70,other_disaster,True,infrastructure_and_utilities_damage,we got hit by a hurricane a earthquake and now a snow storm in a week goddamn new jersey,True
71,earthquake,True,donation_and_volunteering,after deadly earthquake in pakistan the urgent needs are shelter blankets water and medical assistance. prepari,True
72,hurricane,True,affected_individual,as we come back to reality after the storm 1 of our journalist shares her experience w,False
73,other_disaster,True,requests_or_needs,good morning in croixdesbouquets at dagou block near the market people are very hungry they dont receive anything please pass this message for us its idomi,False
74,other_disaster,True,requests_or_needs,good evening the organizations that are helping haiti it is not only the capital that needs help. in the south there a many people who left portauprince with nothing they are hungry please help,True
75,other_disaster,True,requests_or_needs,my goodness everybody getting food. carrefour is not getting anything. please send us something.,False
76,train_crash,True,affected_individual,killed and injured in train derailment accident in new york via,True
77,cyclone,True,donation_and_volunteering,port vila. power is out. water runs in some places.p... cyclonepam portvila vanuatuislands tc pam via,False
78,earthquake,True,donation_and_volunteering,jud faisalabad drives massive donation collection compaign for earthquake victims of awaran judreleif.,True
79,other_disaster,True,requests_or_needs,hello we are a family of ten is it possible for us to get a tent please,False
80,flood,True,donation_and_volunteering,three chinese naval ships arrive in sri lanka to assist in flood relief,True
81,other_disaster,True,requests_or_needs,i would like to know when we will can to give me a good hope,False
82,cyclone,True,injured_or_dead_people,abcnews aid agency predicts death toll to rise from tropical cyclone pam auspol climatechange is a killer.,False
83,flood,True,infrastructure_and_utilities_damage,. the calgary dropin centre reopened and affected clients were brought back this afternoon yycflood,True
84,train_crash,True,affected_individual,blast hits quebec town as train carrying oil derails. dozens of buildings destroyed many residents missing.,True
85,wildfire,True,donation_and_volunteering,fire in california continues to blaze but firefighters gain ground,False
86,flood,True,donation_and_volunteering,exclusive message by appealing nation to come forward and contribute for flood stricken people of pakistan,True
87,other_disaster,True,requests_or_needs,there are people in delmas 32 who form an association who is taking food on the name of the people in that neighborhood. they are just keeping it. it is not being distributed.,False
88,flood,True,infrastructure_and_utilities_damage,heres what parts of calgary look like right now. we are all crushed with the images but we are strong abflood,True
89,earthquake,True,infrastructure_and_utilities_damage,the flag on top of the collapsed building 2da mexicoearthquake,True
90,flood,True,infrastructure_and_utilities_damage,saveuerm flood is about to reach the 3rd floor where the nursery is pls rescueph,True
91,earthquake,True,infrastructure_and_utilities_damage,magnitude7.9 quake strikes kathmandu toppling homes famed ancient temples the japan times,False
92,other_disaster,True,infrastructure_and_utilities_damage,powerful waves also damaged 3 km of sea dike many embankments over 100 houses two schools and 30 salt stocks.,True
93,typhoon,True,donation_and_volunteering,pacquiao fight wont affect typhoon search rescue missions pabloph,True
94,earthquake,True,infrastructure_and_utilities_damage,pray for chile tonight there was an 8.2 earthquake off the coast earlier and from what ive seenread there is a lot of damage. please pray.,True
95,other_disaster,True,requests_or_needs,he advised the community radio broadcasters to intensify ebola sensitization using accurate information.,False
96,earthquake,True,donation_and_volunteering,women victims of earthquake are more needy. female volunteers needed in awaran,True
97,flood,True,affected_individual,heart wrenching reports 11700 evacuated. 17494 housing structures damaged 1502 homes destroyed. coflood,True
98,flood,True,donation_and_volunteering,if you volunteer take mask headlamp rubber glovesboots bug spray sunscreen. also buckets. yychelps yycflood,True
99,hurricane,True,donation_and_volunteering,300 harvey evacuees relocated to temporary housing from george r. brown,False
100,other_disaster,True,requests_or_needs,we will not survive in this chilling winter and hopefully we will be dead. i have children my aged mother and my cattles. please help.district rajanpur,True
101,other_disaster,True,requests_or_needs,why you dont want to help me i know if you want you can help me like orgpam please look what you can do for helping me. its still ulysse carlo.i think you are going to find this message monday.,True
102,hurricane,True,infrastructure_and_utilities_damage,island of barbuda literally under water after hurricane irma,True
103,hurricane,True,donation_and_volunteering,food trucks in columbus raise money for harvey flooding victims in texas more details gtgtgt,True
104,other_disaster,True,requests_or_needs,hi we are in menos road in fontamara 43 in mikis yard we cant handle it anymore please help us,True
105,hurricane,True,infrastructure_and_utilities_damage,90100 of barbudas structures and infrastructure are destroyed irma 2,True
106,other_disaster,True,requests_or_needs,ocha is prepared to serve as a channel for unearmarked cash contributions to be used for immediate relief assistance in coordination with relevant organizations in the united nations system.,False
107,hurricane,True,donation_and_volunteering,btw puerto rico and usvi still need help but seeing as theyre brown and all...,True
108,typhoon,True,donation_and_volunteering,video from masbate. wind and rain picking up due to hagupitph please volunteer and help us monitor the effects...,True
109,other_disaster,True,requests_or_needs,hi since two weeks kmep dont give them any water at bas peu de chose. please send one 1 sos for us. tanks before,False
110,other_disaster,True,requests_or_needs,there has however been an increase in reported cases of diarrhoea unexplained fevers and respiratory infections.,False
111,earthquake,True,donation_and_volunteering,becareful while donating to any ngo or foundation linked to news traders or paid media,False
112,other_disaster,True,requests_or_needs,addis ababa 11 june irin women and children have been forced to eat grass to survive in a remote floodhit area of southern ethiopia the international committee of the red cross icrc said on monday.,True
113,other_disaster,True,infrastructure_and_utilities_damage,for example the countrys centuryold water management system will continue to be overwhelmed during heavy rains until the government invests in an overhaul he said.,False
114,typhoon,True,affected_individual,seven days of tragedy s deeply moving photos from typhoon haiyan,False
115,flood,True,injured_or_dead_people,teamsolamente scores killed in flooding in nepal and india more than 11000 homes have be... teamsolamente,True
116,hurricane,True,infrastructure_and_utilities_damage,exclusive epa opens inquiry into arkema chemical plant explosion after harvey flooding,True
117,earthquake,True,donation_and_volunteering,your response to our appeal has been incredible watch the latest on nepalquake appeal from,False
118,earthquake,True,infrastructure_and_utilities_damage,israeli paramedics in nepal houses just vanished via,False
119,earthquake,True,donation_and_volunteering,crews race to rescue little girl from quake rubble. breaking earthquake mexico,True
120,shooting,True,affected_individual,lax suspect remains heavily sedate under guard usa today u.s. news and world reportlax suspect remains heavi...,False
121,other_disaster,True,requests_or_needs,following cyclone mala and other emergencies in 2006 unicef was able to quickly mobilise and deliver emergency relief goods including family kits insecticide treated bednets and essential drugs for local health centres in the affected areas.,True
122,wildfire,True,infrastructure_and_utilities_damage,luther burbank center heavily damaged by california wildfire by sopan deb via nyt,True
123,earthquake,True,donation_and_volunteering,india send its national disaster rescue force to nepal earthquake indianavengers,True
124,cyclone,True,donation_and_volunteering,nearly 60000 children in need of immediate assistance after cyclone pam in vanuatu,False
125,earthquake,True,injured_or_dead_people,180 bodies retrieved from debris of nepals historic tower outlook wires,False
126,earthquake,True,injured_or_dead_people,bruce jenner still front page of yahoo when 1500 people died in an earthquake in nepal this morning,True
127,other_disaster,True,requests_or_needs,is an effective vaccine already available against the recently identified influenza ah1n1 virus,False
128,cyclone,True,donation_and_volunteering,its been a busy couple of days for adra vanuatu weve also distributed water filtration kits to four...,False
129,earthquake,True,infrastructure_and_utilities_damage,only in california does earthquake damage skatepark. photo by jeremy carroll,True
130,meteor,True,affected_individual,whats new russia cleans up after meteor blast injures more than 1000,False
131,other_disaster,True,requests_or_needs,on friday singapore sent a 42member team from the civil defence force to padang to help with the rescue operations and also transported 50000 us dollars worth of tents blankets and medical supplies.,True
132,shooting,True,affected_individual,lax update lapd confirmed they shot the suspect,False
133,hurricane,True,donation_and_volunteering,rescue workers help people after the area was hit by hurricane maria in guayama puerto rico.,True
134,earthquake,True,donation_and_volunteering,people of nepal urgently need clean water shelter and medical assistance. donate nepalquake,True
135,other_disaster,True,requests_or_needs,i can donate clothing hot meals nonperishable foods and hygiene products .,False
136,other_disaster,True,infrastructure_and_utilities_damage,however the road remains closed due to the fluid security situation.,False
137,flood,True,injured_or_dead_people,india today honour killing girl allegedly shot dead by father in up,True
138,explosion,True,affected_individual,topstories breaking news explosion injuries reported at fertilizer plant near waco in to ...,False
139,explosion,True,affected_individual,multiple injuries reported at texas fertilizer plant explosion,False
140,wildfire,True,infrastructure_and_utilities_damage,california wildfires have been devastatingly arbitrary. some houses stand amid a sea of ash.,True
141,hurricane,True,infrastructure_and_utilities_damage,major hurricane odile struck baja late sunday. photos of damage and firsthand reports here.,True
142,flood,True,donation_and_volunteering,help maringph victims by donating binalot meals via reliefph,True
143,other_disaster,True,requests_or_needs,earlier this week government advisers and the agriculture ministers of two previous governments agreed at a round table that the country would never be able to get rid of the food crisis if it continued to neglect the agriculture sector in the name of industrialisation.,False
144,hurricane,True,donation_and_volunteering,help puerto rico get this supplies if you are truly concerned about puerto rico.,True
145,hurricane,True,donation_and_volunteering,mexico takes back offer to provide hurricane harvey aid to texas to focus on countrys,True
146,flood,True,infrastructure_and_utilities_damage,all brisbane catholic schools open today except for st josephs school gayndah st marys school laidley bigwet qldfloods,True
147,tornado,True,donation_and_volunteering,donations for tornado victims can be dropped off bottled water diapers nonperishable baby formula,True
148,typhoon,True,donation_and_volunteering,. cebu city govt sennds another batch of relief goods to brgys quiot and sudlon i evac centers. rubyph,False
149,other_disaster,True,requests_or_needs,i would like info. on earthquake,True
150,earthquake,True,affected_individual,52 dead in guatemala many more missing due to the earthquake yesterday via,True
151,other_disaster,True,infrastructure_and_utilities_damage,the existing sealevel gauge and seismic network will be upgraded and expanded to ensure accurate and timely tsunami warnings.,False
152,other_disaster,True,injured_or_dead_people,breaking news 2 dead 20 hospitalised over high salt consumption for ebola prevention via,True
153,earthquake,True,donation_and_volunteering,1.4m people need food aid out of 8m affected by nepalearthquake un says,True
154,other_disaster,True,requests_or_needs,as part of merlins nutrition activities an additional 55 metric tonnes of fortified blended foods such as unimix and plumpy nut a high protein and high energy peanutbased therapeutic food product often used to treat severe malnutrition has been distributed in seven union councils of upper swat to communities most vulnerable over winter.,False
155,typhoon,True,affected_individual,death toll from typhoon bopha in philippines climbs to more than 320.,False
156,earthquake,True,donation_and_volunteering,volunteers needed meeting at yellow house sanepa at 5pm to coordinate the relief operations outside ktm nepalquakerelief,True
157,earthquake,True,injured_or_dead_people,danfredinburg dan fredinburg google exec avid climber dan fredinburg killed in massive nepal quak,False
158,shooting,True,affected_individual,breaking. source tells tsa agent who was shot at lax has now died the suspect is an offduty tsa agent.,False
159,earthquake,True,infrastructure_and_utilities_damage,latest pics by earthquake aftermath in kathmandu. nepalearthquake indiawithnepal,True
160,other_disaster,True,requests_or_needs,coats scarves beanies gloves candles some cleaning supplies blanket rice canned soups,False
161,other_disaster,True,requests_or_needs,trendsinindia reliance jio 7th place in india. visit to see all images,False
162,other_disaster,True,requests_or_needs,on board were teams from surfaid and pmi indonesian red cross who reported difficult access to villages due to strong southerly winds buffeting the coast.,False
163,other_disaster,True,requests_or_needs,we are about 100 people in the parking lot of kapitol behind promobank we need help we called no response,True
164,hurricane,True,donation_and_volunteering,tesla just brought solar to a hospital in puerto rico. the rest of the island wont be as easy.,False
165,earthquake,True,donation_and_volunteering,if you would like to make a donation toward disaster relief in nepal you can do so through fellowship.,True
166,earthquake,True,infrastructure_and_utilities_damage,basantapur devastation south side looking north ish. nepalearthquake,True
167,hurricane,True,donation_and_volunteering,i survive hurricanemaria no power no water no batteries no gas no help its not true the help my son rescue me,True
168,hurricane,True,donation_and_volunteering,swling post news nab delivers radios to hurricaneravished puerto rico hamradio hamr,True
169,typhoon,True,donation_and_volunteering,. staff have been deployed to areas projected to be affected by typhoon hagupit rubyph,False
170,flood,True,injured_or_dead_people,india uttar pradesh floods claim 41 lives over 1000 villages hit,True
171,cyclone,True,injured_or_dead_people,devastation hits vanuatu with any casualties. exact of fatalities unknown,False
172,hurricane,True,injured_or_dead_people,collapsed crane 57th st. nyc. sandy,False
173,hurricane,True,infrastructure_and_utilities_damage,raleigh news couple fleeing florida ahead of irma accidentally drives car into hotel pool,False
174,hurricane,True,donation_and_volunteering,some of texas most selfless hurricane harvey heroes are also daca recipients,True
175,other_disaster,True,infrastructure_and_utilities_damage,breaking hurricane matthew batters georgia s.c. coastlines,True
