index,event,disaster,class_label,clean_text,has_crisis_term
3404,not_disaster,False,non-disaster,Just thinking that Great basketball game today. Both teams played with incredible energy and the defense was top-notch. Recommended.,False
3405,not_disaster,False,non-disaster,Today was great! Exploring the beautiful beaches of Bali this week. The sunsets here are unlike anything I have ever seen. Love it.,False
3406,not_disaster,False,non-disaster,Enjoying a peaceful afternoon of golf with friends. The weather is absolutely perfect for being on the course. Can't complain!,False
3407,not_disaster,False,non-disaster,"So glad that Starting a small indoor herb garden on the windowsill. Planting fresh basil, rosemary, and thyme. #blessed",False
3408,not_disaster,False,non-disaster,"Honestly, Had a delicious brunch today. Freshly toasted avocado bread with poached eggs and a hot caramel macchiato. #blessed",False
3409,not_disaster,False,non-disaster,"Wow, Beautiful starry night tonight. The sky is perfectly clear and you can see so many bright constellations. What a day!",False
3410,not_disaster,False,non-disaster,Really enjoying this. Learning how to make authentic Indian curry from scratch. The spice blend smells absolutely heavenly.,False
3411,not_disaster,False,non-disaster,"Honestly, Just arrived in New York City! Ready to see a Broadway show and get some famous New York style pizza.",False
3412,not_disaster,False,non-disaster,Just thinking that Excited about the progress being made in open source software. It empowers developers around the world to build better tools. #blessed,False
3413,not_disaster,False,non-disaster,"Quick update: Starting a small indoor herb garden on the windowsill. Planting fresh basil, rosemary, and thyme. Love it.",False
3414,not_disaster,False,non-disaster,Just wanted to share: Just signed up for a half marathon next month! Time to start a structured training plan and build endurance. Recommended.,False
3415,not_disaster,False,non-disaster,So glad that Visiting the historic ruins in Rome. It is incredible how well these ancient structures have survived.,False
3416,not_disaster,False,non-disaster,Just wanted to share: Enjoying a relaxing weekend getaway at a cozy cabin in the woods. Reading by the fireplace. What a day!,False
3417,not_disaster,False,non-disaster,So glad that Exploring the beautiful beaches of Bali this week. The sunsets here are unlike anything I have ever seen. Perfect.,False
3418,not_disaster,False,non-disaster,Really enjoying this. Started learning how to play tennis this weekend. It is much more challenging than it looks but very fun. Can't complain!,False
3419,not_disaster,False,non-disaster,"Wow, Starting a small indoor herb garden on the windowsill. Planting fresh basil, rosemary, and thyme. Can't complain!",False
3420,not_disaster,False,non-disaster,So glad that Organizing my study room and clearing out old files. A clean and tidy workspace makes me feel so much more productive. Life is good.,False
3421,not_disaster,False,non-disaster,Highly satisfied with the new mechanical keyboard I bought. The tactile feedback and typing sounds are extremely satisfying. What a day!,False
3422,not_disaster,False,non-disaster,"Honestly, Visiting the historic ruins in Rome. It is incredible how well these ancient structures have survived. #blessed",False
3423,not_disaster,False,non-disaster,Having a quiet evening at home watching a classic movie. It is nice to just relax and unwind after a busy week. Recommended.,False
3424,not_disaster,False,non-disaster,Just wanted to share: Taking some time to write down my goals for the upcoming month. It helps keep me focused and motivated. #blessed,False
3425,not_disaster,False,non-disaster,Really enjoying this. Had a really productive day at work today. Checked off everything on my to-do list before the weekend started. Life is good.,False
3426,not_disaster,False,non-disaster,Quick update: Organizing my study room and clearing out old files. A clean and tidy workspace makes me feel so much more productive. :),False
3427,not_disaster,False,non-disaster,"So glad that The design of this application is amazing. Very clean typography, subtle micro-animations, and a beautiful dark mode.",False
3428,not_disaster,False,non-disaster,Quick update: Started learning how to play tennis this weekend. It is much more challenging than it looks but very fun. Love it.,False
3429,not_disaster,False,non-disaster,"Really enjoying this. Developing a web application using clean HTML, modular CSS, and vanilla JS. Love seeing the components come together. What a day!",False
3430,not_disaster,False,non-disaster,"Wow, Completed my morning run today! Managed to hit a new personal record for the 5k distance. Feeling great. :)",False
3431,not_disaster,False,non-disaster,"Honestly, Visited a local farmers market today. Picked up fresh organic strawberries, tomatoes, and homemade honey. :)",False
3432,not_disaster,False,non-disaster,"Honestly, Tried out a new ramen spot in the city. The rich broth and fresh noodles were absolutely incredible. Highly satisfied.",False
3433,not_disaster,False,non-disaster,So glad that Just signed up for a half marathon next month! Time to start a structured training plan and build endurance. What a day!,False
3434,not_disaster,False,non-disaster,"Wow, Developing a web application using clean HTML, modular CSS, and vanilla JS. Love seeing the components come together. What a day!",False
3435,not_disaster,False,non-disaster,"Honestly, Helping my younger brother study for his final chemistry exam. It is fun revisiting these scientific concepts. Life is good.",False
3436,not_disaster,False,non-disaster,"Quick update: Developing a web application using clean HTML, modular CSS, and vanilla JS. Love seeing the components come together. Recommended.",False
3437,not_disaster,False,non-disaster,So glad that Organizing my study room and clearing out old files. A clean and tidy workspace makes me feel so much more productive. Love it.,False
3438,not_disaster,False,non-disaster,"Wow, Trying out a new coding framework today. It simplifies state management and cuts down on boilerplate code significantly.",False
3439,not_disaster,False,non-disaster,So glad that Had a really productive day at work today. Checked off everything on my to-do list before the weekend started. Highly satisfied.,False
3440,not_disaster,False,non-disaster,"Today was great! Developing a web application using clean HTML, modular CSS, and vanilla JS. Love seeing the components come together. :)",False
3441,not_disaster,False,non-disaster,"Wow, Had a delicious brunch today. Freshly toasted avocado bread with poached eggs and a hot caramel macchiato. Life is good.",False
3442,not_disaster,False,non-disaster,So glad that Taking some time to write down my goals for the upcoming month. It helps keep me focused and motivated. Love it.,False
3443,not_disaster,False,non-disaster,"Wow, The view from the top of the Eiffel Tower was absolutely breathtaking. I highly recommend visiting early in the morning. Recommended.",False
3444,not_disaster,False,non-disaster,Quick update: Had a delicious brunch today. Freshly toasted avocado bread with poached eggs and a hot caramel macchiato. What a day!,False
3445,not_disaster,False,non-disaster,The smart home lights I installed yesterday work perfectly. I can control everything with simple voice commands. :),False
3446,not_disaster,False,non-disaster,Just thinking that The new flagship smartphone was just announced today! The camera upgrades and battery life improvements look fantastic. Can't complain!,False
3447,not_disaster,False,non-disaster,Today was great! What an exciting football match tonight! The underdog team scored in the final minutes to win the championship. Life is good.,False
3448,not_disaster,False,non-disaster,"Honestly, Setting up a freshwater aquarium today. Adding some beautiful green plants and colorful neon tetra fish.",False
3449,not_disaster,False,non-disaster,"Wow, Organizing my study room and clearing out old files. A clean and tidy workspace makes me feel so much more productive. Highly satisfied.",False
3450,not_disaster,False,non-disaster,"Honestly, Road trip along the Pacific Coast Highway! Beautiful ocean breeze and infinite winding roads.",False
3451,not_disaster,False,non-disaster,Quick update: Working on a new knitting project. Making a cozy wool scarf for the upcoming cold winter season.,False
3452,not_disaster,False,non-disaster,Just wanted to share: Enjoying a relaxing weekend getaway at a cozy cabin in the woods. Reading by the fireplace. Love it.,False
3453,not_disaster,False,non-disaster,Really enjoying this. Highly satisfied with the new mechanical keyboard I bought. The tactile feedback and typing sounds are extremely satisfying. Highly satisfied.,False
3454,not_disaster,False,non-disaster,"So glad that The design of this application is amazing. Very clean typography, subtle micro-animations, and a beautiful dark mode. Recommended.",False
3455,not_disaster,False,non-disaster,Today was great! Taking photos of local architecture and nature around the city. Capturing beautiful light during golden hour. :),False
3456,not_disaster,False,non-disaster,So glad that I love spending my Sunday afternoons sketching in my notebook. It is a wonderful creative outlet for me. Highly satisfied.,False
3457,not_disaster,False,non-disaster,"Honestly, Swimming laps at the community pool is a great low-impact workout. It leaves me feeling energized for the day. Life is good.",False
3458,not_disaster,False,non-disaster,Just wanted to share: I love the cozy feeling of a rainy day when you can just stay indoors with a good book and a warm blanket. Life is good.,False
3459,not_disaster,False,non-disaster,"Honestly, Completed my morning run today! Managed to hit a new personal record for the 5k distance. Feeling great. Recommended.",False
3460,not_disaster,False,non-disaster,Just thinking that Brewing a fresh pot of single-origin coffee this morning. The aroma is the absolute best way to wake up. Love it.,False
3461,not_disaster,False,non-disaster,Just wanted to share: Working on a new knitting project. Making a cozy wool scarf for the upcoming cold winter season. Highly satisfied.,False
3462,not_disaster,False,non-disaster,Quick update: Planning my next trip to Tokyo. I want to visit the historic temples and try the amazing sushi places. What a day!,False
3463,not_disaster,False,non-disaster,Really enjoying this. I love spending my Sunday afternoons sketching in my notebook. It is a wonderful creative outlet for me. Recommended.,False
3464,not_disaster,False,non-disaster,Just thinking that Started learning how to play tennis this weekend. It is much more challenging than it looks but very fun.,False
3465,not_disaster,False,non-disaster,Really enjoying this. Highly satisfied with the new mechanical keyboard I bought. The tactile feedback and typing sounds are extremely satisfying. Perfect.,False
3466,not_disaster,False,non-disaster,Quick update: Watched an amazing tennis match yesterday. The rallies were incredibly long and full of spectacular shots. :),False
3467,not_disaster,False,non-disaster,"A quiet morning sitting on the balcony, watching the birds and enjoying the fresh morning breeze. Highly satisfied.",False
3468,not_disaster,False,non-disaster,Swimming laps at the community pool is a great low-impact workout. It leaves me feeling energized for the day. :),False
3469,not_disaster,False,non-disaster,"Honestly, Taking photos of local architecture and nature around the city. Capturing beautiful light during golden hour. Life is good.",False
3470,not_disaster,False,non-disaster,Had a really productive day at work today. Checked off everything on my to-do list before the weekend started. Recommended.,False
3471,not_disaster,False,non-disaster,"Enjoying a refreshing fruit smoothie after a long workout. Packed with fresh berries, spinach, and protein. Love it.",False
3472,not_disaster,False,non-disaster,"So glad that Cooking a homemade three-course dinner for my friends tonight. On the menu: steak, roasted vegetables, and tiramisu.",False
3473,not_disaster,False,non-disaster,Just wanted to share: Enjoying a peaceful afternoon of golf with friends. The weather is absolutely perfect for being on the course. Can't complain!,False
3474,not_disaster,False,non-disaster,Organizing my study room and clearing out old files. A clean and tidy workspace makes me feel so much more productive. Perfect.,False
3475,not_disaster,False,non-disaster,"Really enjoying this. Cooking a homemade three-course dinner for my friends tonight. On the menu: steak, roasted vegetables, and tiramisu. Highly satisfied.",False
3476,not_disaster,False,non-disaster,Quick update: Visiting the historic ruins in Rome. It is incredible how well these ancient structures have survived. Can't complain!,False
3477,not_disaster,False,non-disaster,"Wow, Enjoying a refreshing fruit smoothie after a long workout. Packed with fresh berries, spinach, and protein.",False
3478,not_disaster,False,non-disaster,Today was great! Great basketball game today. Both teams played with incredible energy and the defense was top-notch. :),False
3479,not_disaster,False,non-disaster,Just wanted to share: Taking some time to write down my goals for the upcoming month. It helps keep me focused and motivated. What a day!,False
3480,not_disaster,False,non-disaster,Just wanted to share: Had a delicious brunch today. Freshly toasted avocado bread with poached eggs and a hot caramel macchiato. :),False
3481,not_disaster,False,non-disaster,The new flagship smartphone was just announced today! The camera upgrades and battery life improvements look fantastic. Love it.,False
3482,not_disaster,False,non-disaster,"Honestly, Brewing a fresh pot of single-origin coffee this morning. The aroma is the absolute best way to wake up. Love it.",False
3483,not_disaster,False,non-disaster,Today was great! Enjoying a relaxing weekend getaway at a cozy cabin in the woods. Reading by the fireplace.,False
3484,not_disaster,False,non-disaster,Just wanted to share: A hot bowl of chicken noodle soup is so comforting on a chilly rainy evening like this one. Perfect.,False
3485,not_disaster,False,non-disaster,Quick update: Just arrived in New York City! Ready to see a Broadway show and get some famous New York style pizza. Highly satisfied.,False
3486,not_disaster,False,non-disaster,Just wanted to share: Watched an amazing tennis match yesterday. The rallies were incredibly long and full of spectacular shots. What a day!,False
3487,not_disaster,False,non-disaster,"So glad that Enjoying a refreshing fruit smoothie after a long workout. Packed with fresh berries, spinach, and protein. #blessed",False
3488,not_disaster,False,non-disaster,Just thinking that Just finished building a custom desktop PC! Cable management was tough but the final result looks super clean. Life is good.,False
3489,not_disaster,False,non-disaster,Great yoga session this evening. It really helps me stretch out my muscles and clear my mind after a busy week. Life is good.,False
3490,not_disaster,False,non-disaster,Today was great! Just finished building a custom desktop PC! Cable management was tough but the final result looks super clean. :),False
3491,not_disaster,False,non-disaster,"Quick update: Had the most amazing dark chocolate gelato today. It was rich, creamy, and not too sweet. Life is good.",False
3492,not_disaster,False,non-disaster,"Enjoying a refreshing fruit smoothie after a long workout. Packed with fresh berries, spinach, and protein. Perfect.",False
3493,not_disaster,False,non-disaster,"Wow, Having a quiet evening at home watching a classic movie. It is nice to just relax and unwind after a busy week. What a day!",False
3494,not_disaster,False,non-disaster,"Wow, The view from the top of the Eiffel Tower was absolutely breathtaking. I highly recommend visiting early in the morning. Perfect.",False
3495,not_disaster,False,non-disaster,"Honestly, The view from the top of the Eiffel Tower was absolutely breathtaking. I highly recommend visiting early in the morning. Perfect.",False
3496,not_disaster,False,non-disaster,"Just thinking that Developing a web application using clean HTML, modular CSS, and vanilla JS. Love seeing the components come together. :)",False
3497,not_disaster,False,non-disaster,"Wow, Walking my dog in the park this evening. He loves chasing after tennis balls and meeting other friendly dogs. Highly satisfied.",False
3498,not_disaster,False,non-disaster,"Honestly, Trying out a new pottery class today. Molding clay on the wheel is difficult but extremely therapeutic. Life is good.",False
3499,not_disaster,False,non-disaster,Today was great! Walking through the quiet canals of Venice. It feels like stepping straight back into history. #blessed,False
3500,not_disaster,False,non-disaster,Really enjoying this. Swimming laps at the community pool is a great low-impact workout. It leaves me feeling energized for the day. :),False
3501,not_disaster,False,non-disaster,Quick update: The smart home lights I installed yesterday work perfectly. I can control everything with simple voice commands. #blessed,False
3502,not_disaster,False,non-disaster,"Wow, Trying out a new coding framework today. It simplifies state management and cuts down on boilerplate code significantly. :)",False
3503,not_disaster,False,non-disaster,"Cooking a homemade three-course dinner for my friends tonight. On the menu: steak, roasted vegetables, and tiramisu. What a day!",False
3504,not_disaster,False,non-disaster,Today was great! A hot bowl of chicken noodle soup is so comforting on a chilly rainy evening like this one. Can't complain!,False
3505,not_disaster,False,non-disaster,"Wow, Enjoying a refreshing fruit smoothie after a long workout. Packed with fresh berries, spinach, and protein. What a day!",False
3506,not_disaster,False,non-disaster,"Wow, Great basketball game today. Both teams played with incredible energy and the defense was top-notch. Recommended.",False
3507,not_disaster,False,non-disaster,Today was great! Just signed up for a half marathon next month! Time to start a structured training plan and build endurance. Recommended.,False
3508,not_disaster,False,non-disaster,"Just thinking that Cooking a homemade three-course dinner for my friends tonight. On the menu: steak, roasted vegetables, and tiramisu. Life is good.",False
3509,not_disaster,False,non-disaster,"Just wanted to share: Starting a small indoor herb garden on the windowsill. Planting fresh basil, rosemary, and thyme. Highly satisfied.",False
3510,not_disaster,False,non-disaster,Really enjoying this. Organizing my study room and clearing out old files. A clean and tidy workspace makes me feel so much more productive. Perfect.,False
3511,not_disaster,False,non-disaster,Just thinking that Great yoga session this evening. It really helps me stretch out my muscles and clear my mind after a busy week. :),False
3512,not_disaster,False,non-disaster,"Wow, Exploring the beautiful beaches of Bali this week. The sunsets here are unlike anything I have ever seen. What a day!",False
3513,not_disaster,False,non-disaster,"Wow, Taking photos of local architecture and nature around the city. Capturing beautiful light during golden hour. Recommended.",False
3514,not_disaster,False,non-disaster,Spent a quiet afternoon reading historical biographies at the local library. So much fascinating history to learn. Love it.,False
3515,not_disaster,False,non-disaster,Just thinking that Trying out a new pottery class today. Molding clay on the wheel is difficult but extremely therapeutic. Love it.,False
3516,not_disaster,False,non-disaster,Today was great! Just signed up for a half marathon next month! Time to start a structured training plan and build endurance. What a day!,False
3517,not_disaster,False,non-disaster,Today was great! Road trip along the Pacific Coast Highway! Beautiful ocean breeze and infinite winding roads. Love it.,False
3518,not_disaster,False,non-disaster,Planning my next trip to Tokyo. I want to visit the historic temples and try the amazing sushi places. Life is good.,False
3519,not_disaster,False,non-disaster,"Just thinking that The design of this application is amazing. Very clean typography, subtle micro-animations, and a beautiful dark mode. :)",False
3520,not_disaster,False,non-disaster,"Cooking a homemade three-course dinner for my friends tonight. On the menu: steak, roasted vegetables, and tiramisu.",False
3521,not_disaster,False,non-disaster,Today was great! I love spending my Sunday afternoons sketching in my notebook. It is a wonderful creative outlet for me. Love it.,False
3522,not_disaster,False,non-disaster,So glad that Working on a new knitting project. Making a cozy wool scarf for the upcoming cold winter season. Love it.,False
3523,not_disaster,False,non-disaster,Really enjoying this. Highly satisfied with the new mechanical keyboard I bought. The tactile feedback and typing sounds are extremely satisfying.,False
3524,not_disaster,False,non-disaster,So glad that Spent the afternoon painting a landscape scene with watercolors. The blending of the colors turned out great.,False
3525,not_disaster,False,non-disaster,Just thinking that A hot bowl of chicken noodle soup is so comforting on a chilly rainy evening like this one. Can't complain!,False
3526,not_disaster,False,non-disaster,Quick update: Great yoga session this evening. It really helps me stretch out my muscles and clear my mind after a busy week. Love it.,False
3527,not_disaster,False,non-disaster,"Honestly, Taking some time to write down my goals for the upcoming month. It helps keep me focused and motivated. Life is good.",False
3528,not_disaster,False,non-disaster,Really enjoying this. Enjoying a peaceful afternoon of golf with friends. The weather is absolutely perfect for being on the course. Perfect.,False
3529,not_disaster,False,non-disaster,Just thinking that Having a quiet evening at home watching a classic movie. It is nice to just relax and unwind after a busy week. Recommended.,False
3530,not_disaster,False,non-disaster,Today was great! Taking some time to write down my goals for the upcoming month. It helps keep me focused and motivated. Perfect.,False
3531,not_disaster,False,non-disaster,Today was great! Setting up a freshwater aquarium today. Adding some beautiful green plants and colorful neon tetra fish. Perfect.,False
3532,not_disaster,False,non-disaster,"Today was great! A quiet morning sitting on the balcony, watching the birds and enjoying the fresh morning breeze. :)",False
3533,not_disaster,False,non-disaster,Really enjoying this. Going to the local gym to complete an intense weightlifting session. Consistency is the key to progress. Life is good.,False
3534,not_disaster,False,non-disaster,"Wow, Just finished building a custom desktop PC! Cable management was tough but the final result looks super clean.",False
3535,not_disaster,False,non-disaster,So glad that Swimming laps at the community pool is a great low-impact workout. It leaves me feeling energized for the day.,False
3536,not_disaster,False,non-disaster,Really enjoying this. A hot bowl of chicken noodle soup is so comforting on a chilly rainy evening like this one. Life is good.,False
3537,not_disaster,False,non-disaster,Today was great! Just arrived in New York City! Ready to see a Broadway show and get some famous New York style pizza. Highly satisfied.,False
3538,not_disaster,False,non-disaster,"Just thinking that Enjoying a refreshing fruit smoothie after a long workout. Packed with fresh berries, spinach, and protein. Recommended.",False
3539,not_disaster,False,non-disaster,Just wanted to share: Organizing my study room and clearing out old files. A clean and tidy workspace makes me feel so much more productive. :),False
3540,not_disaster,False,non-disaster,Just thinking that Exploring the beautiful beaches of Bali this week. The sunsets here are unlike anything I have ever seen. :),False
3541,not_disaster,False,non-disaster,Beautiful starry night tonight. The sky is perfectly clear and you can see so many bright constellations. Can't complain!,False
3542,not_disaster,False,non-disaster,"Today was great! Visited a local farmers market today. Picked up fresh organic strawberries, tomatoes, and homemade honey. What a day!",False
3543,not_disaster,False,non-disaster,"Honestly, Road trip along the Pacific Coast Highway! Beautiful ocean breeze and infinite winding roads.",False
3544,not_disaster,False,non-disaster,Quick update: Just signed up for a half marathon next month! Time to start a structured training plan and build endurance. :),False
3545,not_disaster,False,non-disaster,Just thinking that Just upgraded my computer with a new graphics card. Games are running at ultra settings with incredibly high frame rates. Life is good.,False
3546,not_disaster,False,non-disaster,Having a quiet evening at home watching a classic movie. It is nice to just relax and unwind after a busy week. :),False
3547,not_disaster,False,non-disaster,"Just thinking that A quiet morning sitting on the balcony, watching the birds and enjoying the fresh morning breeze. Love it.",False
3548,not_disaster,False,non-disaster,"Wow, Completed my morning run today! Managed to hit a new personal record for the 5k distance. Feeling great. Love it.",False
3549,not_disaster,False,non-disaster,"Honestly, Beautiful starry night tonight. The sky is perfectly clear and you can see so many bright constellations. Can't complain!",False
3550,not_disaster,False,non-disaster,Today was great! Trying out a new pottery class today. Molding clay on the wheel is difficult but extremely therapeutic. Love it.,False
3551,not_disaster,False,non-disaster,Today was great! Just signed up for a half marathon next month! Time to start a structured training plan and build endurance.,False
